{
  "schemaVersion": 1,
  "id": "example-dvd-case",
  "displayName": "Example: DVD Case",
  "author": "FoliCon",
  "description": "Sample overlay demonstrating a DVD case frame. Use as a starting point for your own overlays.",
  "overlayVersion": "1.0.0",
  "tags": ["example", "template", "dvd"],
  "designWidth": 265,
  "designHeight": 256,
  "rootMargin": "0,0,0,-11",
  "renderWidth": 256,
  "renderHeight": 256,
  "layerOrder": ["base", "poster", "front", "rating"],
  "baseLayer": {
    "imagePath": "base.png",
    "margin": "30,14,48,15"
  },
  "frontLayer": {
    "imagePath": "front.png",
    "margin": "16,14,35,15"
  },
  "poster": {
    "margin": "31,42,50,19",
    "clipRadius": "0",
    "opacityMaskPath": null
  },
  "rating": {
    "shieldMargin": "160,97,6,5",
    "textMargin": "-4,9.5,4,-9.5",
    "fontSize": 25,
    "fontFamily": "Castellar",
    "fontSource": null,
    "fontFallback": "Segoe UI",
    "textWidth": 55,
    "textHeight": 46,
    "textHorizontalAlignment": "Center",
    "textVerticalAlignment": "Center",
    "textAnchor": "Center"
  },
  "title": {
    "isVisible": false,
    "margin": "0,0,0,0",
    "rotationAngle": 0,
    "rotationOrigin": "0.5,0.5",
    "fontFamily": "Cormorant",
    "fontSource": null,
    "fontFallback": "Segoe UI",
    "foreground": "White",
    "trimming": "WordEllipsis",
    "wrapping": "Wrap",
    "horizontalAlignment": "Left",
    "verticalAlignment": "Top"
  }
}
